{
  "name": "@metorial/workato",
  "description": "Manage Workato recipes, connections, job metadata, folders, deployment status, export packages, lookup rows, data tables, event messages, properties, and API endpoint state. Use API-client endpoint privileges and project scope; operations may require plan or environment access and may retain external effects.",
  "categories": ["apis-and-http-requests", "task-and-project-management"],
  "skills": [
    "manage automation recipes",
    "discover projects and folders",
    "read exact jobs and deployment status",
    "export packages",
    "manage lookup rows and data records",
    "manage event topics and messages",
    "manage properties and API endpoint state"
  ],
  "logoUrl": "https://provider-logos.metorial-cdn.com/workato.png"
}
