{
  "name": "@metorial/boldsign",
  "description": "Send documents and templates for electronic signature, place signer form fields, enable embedded signing, and track document status. List saved contacts, users, and brands. Revoke documents, send reminders, extend signing deadlines, delete documents, and download signed PDFs and audit trails.",
  "categories": ["document-processing", "legal-and-compliance"],
  "skills": [
    "send documents for signature",
    "send documents from templates",
    "embed signing experiences",
    "track document status",
    "download signed documents",
    "manage form fields",
    "list recipients",
    "download audit trails",
    "extend document expiry"
  ],
  "logoUrl": "https://provider-logos.metorial-cdn.com/boldsign.svg"
}
