{
  "name": "@metorial/tavily",
  "description": "Search the web, extract selected pages, and traverse websites with explicit depth, breadth and result limits. Create asynchronous research requests, resume their native status and download completed reports as Markdown or JSON. Read API-key credits separately from account plan usage. Content operations can consume credits and retain provider history; a returned request ID supports reconciliation without recreating an accepted job.",
  "categories": ["apis-and-http-requests", "web-search"],
  "skills": [
    "search the web",
    "extract content from URLs",
    "crawl websites",
    "map website structure",
    "conduct automated research",
    "filter by domain and time",
    "generate AI answers",
    "extract images from pages",
    "track API usage",
    "download completed research reports"
  ],
  "logoUrl": "https://provider-logos.metorial-cdn.com/tavily.svg"
}
