{
  "name": "@metorial/apibible",
  "description": "Browse Bible editions and books, retrieve scripture in HTML, text or JSON form, search keywords and references, and download licensed audio chapters. Responses retain copyright and scripture engagement metadata.",
  "categories": ["document-processing", "education-and-learning"],
  "skills": [
    "browse Bible versions",
    "retrieve scripture passages",
    "search Bible text",
    "list books and chapters",
    "retrieve audio Bibles",
    "filter Bibles by language",
    "get verse content",
    "list thematic sections"
  ],
  "logoUrl": "https://provider-logos.metorial-cdn.com/api-bible.png"
}
