{
  "name": "@metorial/bubble",
  "description": "Read and manage exposed Bubble data records, search with native filters, invoke configured API workflows, discover API schemas and download bounded JSON exports. Access depends on the app branch, token mode and privacy rules.",
  "categories": ["apis-and-http-requests", "task-and-project-management"],
  "skills": [
    "create and edit exposed records",
    "search and filter visible data",
    "delete exact records",
    "invoke configured API workflows",
    "discover exposed API schemas",
    "download JSON record exports"
  ],
  "logoUrl": "https://provider-logos.metorial-cdn.com/bubble.jpg"
}
