{
  "name": "@metorial/elevenreader",
  "description": "Generate and download ElevenLabs speech and sound effects, transcribe audio, design and manage voices, isolate vocals, and create, inspect, download, or delete automatic dubbing projects. Browse voices, models, pronunciation dictionaries, account usage, and generation history. Uses the ElevenLabs API; ElevenReader library access is not provided.",
  "categories": [
    "apis-and-http-requests",
    "language-translation",
    "speech-recognition-and-synthesis"
  ],
  "skills": [
    "generate speech audio",
    "transcribe audio",
    "discover and manage voices",
    "design and save voices",
    "generate sound effects",
    "create and download automatic dubs",
    "isolate vocals",
    "download generated audio history",
    "browse pronunciation dictionaries",
    "inspect account usage"
  ]
}
