{
  "name": "@metorial/textit",
  "description": "Manage TextIt contacts, groups, fields, and global variables. Send individual messages and multilingual broadcasts, start conversational flows, inspect runs and asynchronous status, configure campaign events, manage ticket actions, and discover workspace users, topics, labels, channels, and identity.",
  "categories": ["crm-and-sales-tools", "email-and-messaging", "task-and-project-management"],
  "skills": [
    "send messages and broadcasts",
    "manage contacts and groups",
    "start and inspect automated flows",
    "configure campaign events",
    "manage support ticket actions",
    "discover fields labels and topics",
    "inspect workspace users and identity"
  ],
  "logoUrl": "https://provider-logos.metorial-cdn.com/textit.png"
}
