{
  "name": "@metorial/docnify",
  "description": "Create, send, and manage electronic document signatures. Create documents from templates, add recipients, and send documents for signing. Monitor document lifecycle events including creation, individual recipient signatures, and full completion when all recipients have signed.",
  "categories": ["document-processing", "legal-and-compliance", "task-and-project-management"],
  "skills": [
    "create document from template",
    "add document recipients",
    "send document for signing",
    "monitor document completion",
    "track recipient signatures",
    "manage e-signature workflows",
    "retrieve document details"
  ]
}
