{
  "name": "@metorial/realphonevalidation",
  "description": "Validate US phone numbers and email addresses in real-time using live telco data. Check phone connection status (connected/disconnected), identify phone type (mobile, landline, VoIP), retrieve carrier and subscriber information, and look up Do Not Call list status including national, state, and DMA lists. Score phone numbers for fraud risk, detect reassigned numbers since a given consent date, and identify TCPA litigators. Verify email addresses with legacy validity checks or REV Lightning reachability, catch-all, disposable, free-service, ISP, and caution flags. Supports full validation (Turbo), budget-friendly list scrubbing (Scrub), basic active number checks, and wireless/phone type identification for TCPA compliance.",
  "categories": ["crm-and-sales-tools", "legal-and-compliance", "security"],
  "skills": [
    "validate phone connection status",
    "identify phone type",
    "lookup Do Not Call lists",
    "score phone fraud risk",
    "detect reassigned numbers",
    "verify email addresses",
    "retrieve carrier information",
    "identify TCPA litigators",
    "check wireless number status"
  ],
  "logoUrl": "https://provider-logos.metorial-cdn.com/realphonevalidation.png"
}
