{
  "name": "@metorial/rafflys",
  "description": "Retrieve your Rafflys account profile, list promotions, and read the leads collected by a promotion, including available contact details and custom form fields.",
  "categories": ["crm-and-sales-tools", "news-and-media"],
  "skills": [
    "retrieve account details",
    "discover promotion IDs",
    "list promotions",
    "retrieve promotion leads",
    "read lead contact details",
    "read custom lead form fields"
  ],
  "logoUrl": "https://provider-logos.metorial-cdn.com/rafflys.png"
}
