{
  "name": "@metorial/wisepops",
  "description": "Export contacts and leads collected through website popup campaigns, including emails, phone numbers, and custom form fields. Retrieve campaign reporting metrics such as display counts, click counts, and email counts. Manage webhooks for real-time notifications on email, phone, and survey form submissions. Delete and suppress end-user data for GDPR/CCPA compliance.",
  "categories": ["apis-and-http-requests", "crm-and-sales-tools"],
  "skills": [
    "export collected contacts",
    "retrieve campaign metrics",
    "manage webhooks",
    "filter contacts by date",
    "delete user data for GDPR",
    "list popup campaigns",
    "receive form submissions"
  ]
}
