{
  "name": "@metorial/twitch",
  "description": "Discover Twitch users, channels, streams, clips and videos. Manage supported channel settings, chat, moderation, followers and subscriptions, polls, predictions, rewards, raids and roles. Download an exact clip rendition. Native token grants and broadcaster, moderator, live-channel and feature requirements apply.",
  "categories": ["document-processing", "email-and-messaging", "news-and-media"],
  "skills": [
    "discover users and channels",
    "monitor live streams",
    "send chat messages and announcements",
    "moderate users and chat",
    "view followers and subscriptions",
    "create and download clips",
    "manage channel points rewards",
    "run polls and predictions",
    "manage raids and roles"
  ],
  "logoUrl": "https://provider-logos.metorial-cdn.com/twitch-logo.jpeg"
}
