{
  "name": "@metorial/sslmate-cert-spotter-api",
  "description": "Monitor Certificate Transparency logs to detect SSL/TLS certificates issued for your domains. Search for certificates by domain name, including subdomains, with deduplication and incremental querying. Manage monitored domains by adding, removing, enabling, or disabling them. Authorize known certificates and public keys to reduce alert noise from legitimate renewals.",
  "categories": ["apis-and-http-requests", "security"],
  "skills": [
    "search certificates by domain",
    "monitor domain certificates",
    "manage monitored domains",
    "authorize known certificates",
    "authorize public keys via CSR",
    "detect unauthorized certificates",
    "discover new endpoints",
    "query certificate transparency logs",
    "configure webhook notifications"
  ],
  "logoUrl": "https://provider-logos.metorial-cdn.com/sslmate-cert-spotter-api.png"
}
