{
  "name": "@metorial/codacy",
  "description": "Review repository, commit, pull request, and file analysis. Search code quality issues, security findings, and SBOM dependencies. Inspect coverage, quality thresholds, analysis tools, and code patterns. Discover organizations, members, coding standards, and branches. Manage security finding ignore states, DAST targets and scans, and repository API tokens.",
  "categories": ["apis-and-http-requests", "security"],
  "skills": [
    "review code quality and coverage",
    "discover organizations and repositories",
    "inspect analysis tools and patterns",
    "read repository quality thresholds",
    "search security vulnerabilities",
    "inspect security remediation details",
    "ignore or restore security findings",
    "trigger DAST scans",
    "search SBOM dependencies",
    "review pull request and commit analysis",
    "manage repository API tokens"
  ],
  "logoUrl": "https://provider-logos.metorial-cdn.com/codacy.svg"
}
