{
  "name": "@metorial/ragic",
  "description": "Manage records in Ragic database sheets with filters, full-text search, sorting, and pagination. Discover field definitions with manager permissions, upload files and images, prepare downloads and record exports, add comments, lock or unlock records, and execute configured action buttons.",
  "categories": ["apis-and-http-requests", "task-and-project-management"],
  "skills": [
    "create and update records",
    "query and filter records",
    "delete database records",
    "discover field definitions",
    "upload and retrieve files",
    "export records to PDF/Excel",
    "add record comments",
    "lock and unlock records",
    "trigger action buttons"
  ],
  "logoUrl": "https://provider-logos.metorial-cdn.com/ragic.jpeg"
}
