{
  "name": "@metorial/groqcloud",
  "description": "Run AI inference on open-source language models with ultra-low latency using Groq's LPU hardware. Generate text via chat completions and the Responses API, produce structured JSON outputs, and perform function calling with built-in, remote (MCP), or local tools. Transcribe and translate audio using Whisper models, convert text to speech, and analyze images with multimodal vision models. Support chain-of-thought reasoning, content moderation with custom policies, asynchronous chat-completions batch processing, and Groq file upload/download workflows. List and query available hosted models.",
  "categories": ["apis-and-http-requests", "speech-recognition-and-synthesis"],
  "skills": [
    "generate text completions",
    "create model responses",
    "produce structured JSON outputs",
    "call functions and tools",
    "transcribe audio to text",
    "translate spoken audio",
    "convert text to speech",
    "analyze images with vision",
    "moderate content",
    "batch process requests",
    "manage batch files",
    "list available models"
  ],
  "logoUrl": "https://provider-logos.metorial-cdn.com/groqcloud.svg"
}
